{
  "$schema": "https://json-schema.org/draft/2020-12/schema",
  "$id": "https://pgextwin.github.io/catalog/schema/extension.schema.json",
  "title": "pgextwin catalog extension record",
  "type": "object",
  "additionalProperties": false,
  "required": [
    "schemaVersion",
    "name",
    "displayName",
    "description",
    "upstream",
    "repository",
    "license",
    "architecture",
    "latest",
    "postgresql",
    "runtime"
  ],
  "properties": {
    "schemaVersion": { "const": 1 },
    "name": {
      "type": "string",
      "pattern": "^[A-Za-z0-9_.-]+$"
    },
    "displayName": {
      "type": "string",
      "minLength": 1
    },
    "description": {
      "type": "string",
      "minLength": 1
    },
    "upstream": {
      "type": "object",
      "additionalProperties": false,
      "required": ["repository", "version"],
      "properties": {
        "repository": {
          "type": "string",
          "pattern": "^[^/]+/[^/]+$"
        },
        "version": {
          "type": "string",
          "minLength": 1
        }
      }
    },
    "repository": {
      "type": "string",
      "pattern": "^pgextwin/[A-Za-z0-9_.-]+$"
    },
    "license": {
      "type": "string",
      "minLength": 1
    },
    "architecture": {
      "const": "x64"
    },
    "latest": {
      "type": "object",
      "additionalProperties": false,
      "required": ["releaseTag"],
      "properties": {
        "releaseTag": {
          "type": "string",
          "minLength": 1
        }
      }
    },
    "postgresql": {
      "type": "object",
      "minProperties": 1,
      "additionalProperties": {
        "type": "object",
        "additionalProperties": false,
        "required": ["available"],
        "properties": {
          "available": { "type": "boolean" },
          "asset": { "type": "string" }
        }
      }
    },
    "runtime": {
      "type": "object",
      "additionalProperties": false,
      "required": ["sharedPreloadLibraries"],
      "properties": {
        "sharedPreloadLibraries": {
          "type": "array",
          "uniqueItems": true,
          "items": { "type": "string" }
        }
      }
    }
  }
}
